conceptType,conceptUri,preferredLabel,status,skillType,reuseLevel,altLabels,description,broaderConceptUri,broaderConceptPT
KnowledgeSkillCompetence,http://data.europa.eu/esco/skill/bb4f3174-8d64-478b-8d9b-5f37cbf557b7,إدارة وفود الزوار في المحميات,released,skill/competence,sector-specific,,"توجيه وفود الزوار في المناطق الطبيعية المحمية، بشكل يقلل الوقع على الأجل الطويل للزوار ويضمن المحافظة على النباتات والحيوانات البرية المحلية، وبما يتفق مع القوانين حول البيئة.
   ",http://data.europa.eu/esco/skill/15fa3879-ac0e-46e6-ae36-609bae9c19c3,مراقبة الأنشطة التشغيلية
KnowledgeSkillCompetence,http://data.europa.eu/esco/skill/bb859329-0cd8-45c0-a09f-48b6dcd9fc1a,حماية الأشجار,released,skill/competence,sector-specific,,المحافظة على الأشجار مع مراعاة سلامة وظروف الشجرة (الأشجار) وخطط صيانة المنطقة والمحافظة عليها. يشمل ذلك قطع الأشجار أو الفروع الموجودة على الأشجار مع تطبيق المعرفة بشأن بيولوجيا الشجرة.,http://data.europa.eu/esco/skill/8df12fb1-7f41-4068-8d05-007e8fec8f33 | http://data.europa.eu/esco/skill/8064ae65-5d1b-44e1-9aaf-246a4285a9a6,الحفاظ على الغابات | الالتزام بقوانين ومعايير حماية البيئة
KnowledgeSkillCompetence,http://data.europa.eu/esco/skill/bbfb0e36-807c-492f-bed2-267224ba7bc7,قيادة البحث في تفادي بقايا الغذاء,released,skill/competence,cross-sector,,"البحث وتقييم الأساليب، والمعدات والتكاليف بغية خفض نفايات الغذاء وإدارتها. الإشراف على بيانات القياس والتعرف على مواقع التحسين المتعلقة بتفادي نفايات الغذاء.
	",http://data.europa.eu/esco/skill/7eafec38-621a-4b6e-9298-bfe70ec0b253,تنفيذ البحوث الأكاديمية أو أبحاث السوق
KnowledgeSkillCompetence,http://data.europa.eu/esco/skill/bc70f963-c1c0-49a5-b940-3e28e163db45,خطة تدابير المحافظة على التراث الثقافي,released,skill/competence,sector-specific,,"إعداد خطط الحماية من الكوارث غير المتوقعة من أجل خفض وقعها على التراث الثقافي مثل المباني، أو الهياكل أو المناظر الطبيعية.
   ",http://data.europa.eu/esco/skill/164510d1-1216-4dc0-b9d1-a7f6af19e469,تطوير خطط الطوارئ والاستجابة للطوارئ
KnowledgeSkillCompetence,http://data.europa.eu/esco/skill/bc97c755-2174-4d02-adaf-21b8b1863742,إدارة الجوانب البيئية للنقل المائي الداخلي,released,skill/competence,sector-specific,,دراسة الجوانب البيئية لإدارة السفن لاستخدامها بطريقة فعَّالة وآمنة بيئيًا. وتتضمن فهم الجوانب البيئية للنقل عبر الممرات المائية الداخلية.,http://data.europa.eu/esco/skill/8064ae65-5d1b-44e1-9aaf-246a4285a9a6,الالتزام بقوانين ومعايير حماية البيئة
KnowledgeSkillCompetence,http://data.europa.eu/esco/skill/bce60ecd-ceee-4dbd-b619-70c9789ec634,اختبار إحكام وضغط دوائر التبريد,released,skill/competence,occupation-specific,,"تنفيذ اختبارات ضغط النظام في أنظمة التبريد، وتكييف الهواء أو مضخات الحرارة باستخدام الغاز المضغوط ومضخات الخواء للتحقق من إحكام دائرة التبريد والأجزاء التي تكونها.
	",http://data.europa.eu/esco/skill/a7065828-10aa-4aba-b7d4-f23a30df5060,تركيب وإصلاح المعدات الكهربائية والإلكترونية والدقيقة
KnowledgeSkillCompetence,http://data.europa.eu/esco/skill/bd70f004-e1d6-43f0-96f1-59c014a4ea01,تنسيق الجهود البيئية,released,skill/competence,cross-sector,,تنسيق جميع الجهود البيئية التي تبذلها الشركة ودمجها؛ بما في ذلك مكافحة التلوث وإعادة التدوير وتصريف النفايات والصحة البيئية والحفاظ على البيئة والطاقة المتجددة.,http://data.europa.eu/esco/skill/4c3ab565-747c-4db3-8c47-79e8d6f98cf4 | http://data.europa.eu/esco/skill/8064ae65-5d1b-44e1-9aaf-246a4285a9a6,تبني سبل تخفيف وطأة الاستهلاك السلبية | الالتزام بقوانين ومعايير حماية البيئة
KnowledgeSkillCompetence,http://data.europa.eu/esco/skill/be973dc1-6aa9-4aed-954c-644affe78639,تطبيق شرائط العزل,released,skill/competence,cross-sector,,تطبيق شرائط العزل التي تمنع تبادل الهواء بين الأماكن الخارجية والأماكن المغلقة.,http://data.europa.eu/esco/skill/0edd863d-b02d-4714-a1a2-835d6dd23c55,تركيب مواد العزل
KnowledgeSkillCompetence,http://data.europa.eu/esco/skill/bed97655-cb0c-4f05-bfd7-9a79d058619d,مشاريع الحياة البرية,released,knowledge,sector-specific,,مشاريع الحفاظ على الحياة البرية والحيوانية، والتي تهدف إلى حماية والحفاظ على النظم البيئية والموائل لمجموعة واسعة من الحيوانات الواقعة تحت تهديد التوسع الحضري.,http://data.europa.eu/esco/isced-f/0522,
KnowledgeSkillCompetence,http://data.europa.eu/esco/skill/bf056c12-eaba-4f00-b5a9-c4add7f841f3,مواد المناظر الطبيعية,released,knowledge,sector-specific,,مجال معلومات يحدد بعض المواد المطلوبة، مثل الخشب ورقائقه والأسمنت والحصى والتربة لأغراض المناظر الطبيعية.,http://data.europa.eu/esco/isced-f/0812,
KnowledgeSkillCompetence,http://data.europa.eu/esco/skill/bf4779c9-ce55-4110-a996-a7014ca3f1f9,تقنيات السيارات الخضراء,released,knowledge,sector-specific,,"التقنيات التي تتيح تطوير الممارسات المستدامة في صناعة السيارات. وتركز على خفض الآثار السلبية لهذه الصناعة على البيئة مثل تلوث الهواء أو استخدام المصادر غير المتجددة، وتركز أيضاً على استخدام الأساليب الخضراء في تصميم وتصنيع منتجات السيارات.
	",http://data.europa.eu/esco/isced-f/0712,
KnowledgeSkillCompetence,http://data.europa.eu/esco/skill/bf9a2403-850d-4dd3-b266-edaabebc8ab0,تقييم التصميم المندمج للمباني,released,skill/competence,sector-specific,,"استخدام الأهداف والمقاصد كوسائل لقياس نجاح التصاميم المقترحة. تطبيق، وجمع وتقييم الأساليب المتقدمة لتحليل التفاعل بين أنظمة الطاقة، المفاهيم المعمارية، تصميم المبنى، استعمال المبنى، الطقس الخارجي وأنظمة التدفئة والتهوية وتكييف الهواء (HVAC).
	",http://data.europa.eu/esco/skill/1f2950c0-ef1e-44b4-9a55-125ccd7b78af,تحليل المعلومات والبيانات وتقييمها
KnowledgeSkillCompetence,http://data.europa.eu/esco/skill/bfa5427c-83ec-404f-8465-dd49b42fde8e,تنظيف العبوات القابلة لإعادة الاستخدام,released,knowledge,sector-specific,,طرق تنظيف وتعقيم العبوات القابلة لإعادة الاستخدام لمنع أو إزالة الرواسب ذات الطبيعة العضوية أو غير العضوية.,http://data.europa.eu/esco/isced-f/1021,
KnowledgeSkillCompetence,http://data.europa.eu/esco/skill/c0133edf-845a-47bf-968b-bd4a5bd03bbf,إستخدام معدات التدفئة المائية,released,skill/competence,sector-specific,,تشغيل معدات تسخين المياه والضخ حسب الاقتضاء مثل السخانات الكهربائية ومبادلات الحرارة والمضخات الحرارية والمضخات الشمسية.,http://data.europa.eu/esco/skill/8bf9699c-f964-4e4b-ac3d-55aface09cbc,تشغيل معدات إنتاج أو توزيع الطاقة
KnowledgeSkillCompetence,http://data.europa.eu/esco/skill/c0ccbd15-36f3-4515-ae0b-b4062d225ee2,الالتزام باللوائح المتعلقة بالمواد المحظورة,released,skill/competence,sector-specific,,الامتثال للوائح التي تحظر المعادن الثقيلة في اللحام، ومثبطات اللهب في المواد البلاستيكية، وملدنات الفثالات في المواد البلاستيكية والمواد العازلة للأسلاك، بموجب توجيهات الاتحاد الأوروبي للحد من المواد الخطرة (RoHS)/توجيه النفايات الكهربائية والأجهزة الإلكترونية WEEE والتشريعات الصينية بخصوص توجيه الحد من المواد الخطرة.,http://data.europa.eu/esco/skill/35dc2a23-cdc3-4291-930f-927ba2911949,ضمان الالتزام بالقوانين واللوائح
KnowledgeSkillCompetence,http://data.europa.eu/esco/skill/c1de3963-05eb-4e45-8496-58156a345fb1,تحويل الطلب على الطاقة,released,skill/competence,sector-specific,,توفير إمكانية إيقاف مؤقت لأنظمة توليد الطاقة الكهربائية عن طريق تحويل الطلب على الطاقة. الهدف من ذلك الحد من انقطاع الطاقة لدى العملاء أثناء تحديد مشكلة معينة والتعامل معها.,http://data.europa.eu/esco/skill/8bf9699c-f964-4e4b-ac3d-55aface09cbc,تشغيل معدات إنتاج أو توزيع الطاقة
KnowledgeSkillCompetence,http://data.europa.eu/esco/skill/c214d86e-fbb8-45c0-87d4-f2cefc954057,اختيار تصميم التكنولوجيات المستدامة,released,skill/competence,sector-specific,,"إنتاج تصميم متكامل، يشمل القياسات الخاملة التي تكملها تكنولوجيات نشطة بطريقة معقولة.
	",http://data.europa.eu/esco/skill/62afcfdd-a2a6-4143-bafb-59c77e15a01c | http://data.europa.eu/esco/skill/01c03003-516d-43c6-8477-45c472413521,تقديم المشورة بشأن المنتجات والخدمات | تقديم المشورة بشأن مواد البناء
KnowledgeSkillCompetence,http://data.europa.eu/esco/skill/c291df22-0d6b-4cea-8feb-11c350a33081,مراقبة مستويات الإشعاع,released,skill/competence,cross-sector,,استخدام معدات وتقنيات القياس والاختبار لتحديد مستويات الإشعاع أو المواد المشعة من أجل التحكم في التعرض والحد من مخاطر الصحّة والسلامة والبيئة.,http://data.europa.eu/esco/skill/d519fadd-85bf-475f-bf14-c53a0290687d | http://data.europa.eu/esco/skill/d2d9051a-10e1-41c5-9cfb-bbdc58016176,مراقبة الظروف البيئية | إتباع احتياطات السلامة في ممارسات العمل
KnowledgeSkillCompetence,http://data.europa.eu/esco/skill/c29fed5c-f03b-4389-b110-29b6db00cd01,التخلص من النفايات غير الغذائية في صناعة الأغذية,released,skill/competence,sector-specific,,التخلص من النفايات غير الغذائية في صناعة الأغذية عن طريق اتخاذ إجراءات مقبولة بيئيًّا للتخلص منها.,http://data.europa.eu/esco/skill/61d1dab2-6007-4b7c-9380-cd88207fa30f,التخلص من النفايات غير الخطرة أو الحطام
KnowledgeSkillCompetence,http://data.europa.eu/esco/skill/c3108ed8-de97-41fc-9ff7-8c028e662734,التكنولوجيا الحيوية في تربية الأحياء المائية,released,knowledge,cross-sector,,تفاعلات التكنولوجيا الحيوية وسلسلة البوليميراز في دراسات طرق الإنتاج المستدام لتربية الأحياء المائية.,http://data.europa.eu/esco/skill/61bef658-d7f9-4759-b1b0-0f9cb3bc581a | http://data.europa.eu/esco/isced-f/0831,
KnowledgeSkillCompetence,http://data.europa.eu/esco/skill/c33877c2-be85-458b-ab59-327c1c6a3507,إصلاح معدات التهوية,released,skill/competence,cross-sector,,فحص نظام التهوية لاكتشاف التلف، وتنظيف فتحات التهوية، واستبدال مرشحات التدفئة وتحديد مواعيد زمنية للمزيد من أعمال الصيانة أو الإصلاحات.,http://data.europa.eu/esco/skill/b85caa4a-f04b-4331-80df-11404fd71225,تركيب معدات التدفئة والتهوية وتكييف الهواء
KnowledgeSkillCompetence,http://data.europa.eu/esco/skill/c36dc79e-3414-4283-a85d-f664a523837f,تثقيف الجمهور حول الحياة البرية,released,skill/competence,cross-sector,,التحدث مع مجموعات من البالغين والأطفال لتعليمهم كيفية الاستمتاع بالغابة دون إلحاق الضرر بها أو بأنفسهم. التحدّث في المدارس أو مع مجموعات شبابية محدَّدة إذا طُلب ذلك. تطوير وتعليم برامج متعلقة بحفظ الطبيعة.,http://data.europa.eu/esco/skill/335be43a-3267-400e-b5cb-c9e234dc7544,تدريس المواد الأكاديمية أو المهنية
KnowledgeSkillCompetence,http://data.europa.eu/esco/skill/c3ac5c4c-b4b9-4842-b871-43e12cfc0442,ممارسات المباني الخضراء,released,knowledge,sector-specific,,"الممارسات المشاركة في تصميم وإنشاء هياكل المباني بطريقة مسؤولة بيئياً وفعالة من حيث التكلفة ومن حيث الموارد. وتستكمل ممارسات المباني الخضراء، مثل استخدام مواد البناء الصديقة للبيئة، وممارسات البناء الكلاسيكية التي تسعى إلى دورة حياة بناء مستدامة وعالية الأداء.
	",http://data.europa.eu/esco/isced-f/0732,
KnowledgeSkillCompetence,http://data.europa.eu/esco/skill/c3bb5700-a94d-407a-8cd0-147727378f25,آثار التلوث الحضري,released,knowledge,sector-specific,,"مجموعة من الملوثات التي تُخلِّفها المدن وآثارها على الهواء والماء والأرض والبيئة ككل. 
 
 
 ",http://data.europa.eu/esco/isced-f/0712,
KnowledgeSkillCompetence,http://data.europa.eu/esco/skill/c4867766-50f8-489e-98d7-262da5589c0a,منتجات الطاقة الشمسية,released,knowledge,cross-sector,,"الأصناف والميزات الرئيسية لمنتجات الطاقة الشمسية مثل الألواح الشمسية أو سخانات المياه بالطاقة الشمسية أو أجهزة الشحن التي تعمل بالطاقة الشمسية. وعلاوة على ذلك، معرفة وظائفها ومكوناتها ومتطلباتها القانونية.
	",http://data.europa.eu/esco/skill/f8413360-6114-40de-a276-c59b764b9913 | http://data.europa.eu/esco/isced-f/0713,
KnowledgeSkillCompetence,http://data.europa.eu/esco/skill/c4b03a17-a93e-4a8e-9846-4c4d469d4001,الزراعة الإيكولوجية,released,knowledge,sector-specific,,"هي دراسة وتطبيق أسس ومفاهيم الإيكولوجيا والزراعة على أنظمة الإنتاج الزراعي.
   ",http://data.europa.eu/esco/skill/a8429098-ddac-481b-91e7-688d021c092e | http://data.europa.eu/esco/isced-f/0811,
KnowledgeSkillCompetence,http://data.europa.eu/esco/skill/c4ba12d1-4698-42fa-8abb-789462ea2586,حماية البيئة من تأثير التكنولوجيات الرقمية,released,skill/competence,occupation-specific,,الدراية بالآثار البيئيّة للتكنولوجيّات الرّقميّة واستخداماتها.,http://data.europa.eu/esco/skill/2aaad52d-599e-4e77-a681-bbc236825821 | http://data.europa.eu/esco/skill/426ceaba-6867-481c-bb6b-aee3933da7d2 | http://data.europa.eu/esco/skill/8064ae65-5d1b-44e1-9aaf-246a4285a9a6,تقييم آثار التصرفات الشخصية على البيئة | سلامة تكنولوجيا المعلومات والاتصالات|سلامة تكنولوجيا المعلومات والاتصالات | الالتزام بقوانين ومعايير حماية البيئة
KnowledgeSkillCompetence,http://data.europa.eu/esco/skill/c4e9f0d0-bbdd-42d7-83a5-2c131f6d67c2,وضع سياسة الطاقة,released,skill/competence,sector-specific,,وضع إستراتيجيّات المؤسسات المُتعلّقة بأداء الطّاقة الخاص بها والمحافظة عليها.,http://data.europa.eu/esco/skill/8ed41305-4abf-4b54-9f8f-0e043d26feba,تطوير السياسات والأنظمة
KnowledgeSkillCompetence,http://data.europa.eu/esco/skill/c4f97536-866b-4a4f-b91d-da07809ef2d8,تنفيذ دراسة جدوى الهيدروجين,released,skill/competence,sector-specific,,"تنفيذ عمليات تقدير وتقييم استعمال الهيدروجين كبديل للوقود. مقارنة التكاليف، والتكنولوجيات والموارد المتاحة لإنتاج ونقل وتخزين الهيدروجين. الأخذ في الاعتبار التأثير على البيئة لدعم عملية صنع القرار.
	",http://data.europa.eu/esco/skill/d74df140-eb69-43e2-bac9-1cafc824d702 | http://data.europa.eu/esco/skill/ec528c47-65f4-4187-9dc1-5a8889f84a06,تنفيذ دراسة الجدوى | تحليل العمليات التجارية
KnowledgeSkillCompetence,http://data.europa.eu/esco/skill/c5320743-60f2-40dc-bc13-337cc3834892,دراسة المياه الجوفية,released,skill/competence,sector-specific,,إعداد الدّراسات الميدانية وإجراؤها من أجل تحديد جودة المياه الجوفية. دراسة الخرائط والنّماذج والبيانات الجغرافية وتفسيرها. وضع صورة للمياه الجوفية في المنطقة وتلوّث الأرض. تقديم تقارير بشأن القضايا المُتعلّقة بالمياه الجوفية في المكبّ مثل تلوّث المنطقة بسبب مُنتجات حرق الفحم.,http://data.europa.eu/esco/skill/2db2667c-bbaf-4e30-8640-c9a647bd2512 | http://data.europa.eu/esco/skill/3eef7ff2-3ade-41d4-b084-2bd2a3949e1c,إجراء تحليل المياه | تقييم الأراضي أو العقارات
KnowledgeSkillCompetence,http://data.europa.eu/esco/skill/c565e722-0e14-4f57-99ff-267dd9ea2510,التعاون في مشاريع الطاقة الدولية,released,skill/competence,sector-specific,,تقديم خبرات تتعلّق بتوفير وكفاءة الطّاقة لتنفيذ المشاريع الدوليّة؛ بما في ذلك المشاريع التي ينطوي عليها مجال التّعاون الإنمائي.,http://data.europa.eu/esco/skill/062a9fde-cd91-44f9-9a2f-9e2bc3b281fd,تقديم المشورة بشأن القضايا البيئية
KnowledgeSkillCompetence,http://data.europa.eu/esco/skill/c582dd36-a83d-4d61-b87a-364b84950a3f,تثبيت حاويات إعادة التدوير,released,skill/competence,sector-specific,,الحرص على تركيب حاويات في الأماكن المُناسبة لإعادة تدوير النّفايات مثل الورق المُقوّى، والزجاجات، والملابس.,http://data.europa.eu/esco/skill/61d1dab2-6007-4b7c-9380-cd88207fa30f,التخلص من النفايات غير الخطرة أو الحطام
KnowledgeSkillCompetence,http://data.europa.eu/esco/skill/c5afeb33-4291-44c9-a89a-373185d0bfef,دراسة العلاقة بين المباني والناس والبيئة,released,skill/competence,occupation-specific,,فهم العلاقات والتفاعلات بين الأشخاص والمباني والبيئة لمواءمة الأعمال المعمارية مع الاحتياجات الإنسانية.,http://data.europa.eu/esco/skill/8fde007e-ea4c-48c2-84c5-752834acd31d,إجراء الدراسات والأبحاث والفحوصات
KnowledgeSkillCompetence,http://data.europa.eu/esco/skill/c65ac31c-fdaf-4e87-beca-8ed952c3aa35,طاقة الغاز الحيوي,released,knowledge,sector-specific,,"إنتاج الطاقة من أجل الماء الساخن الصالح للشرب والتدفئة باستخدام الغاز الأحيائي (يتم توليد الغاز الأحيائي خارج الموقع) ومساهمته في أداء الطاقة.
	",http://data.europa.eu/esco/skill/f8413360-6114-40de-a276-c59b764b9913 | http://data.europa.eu/esco/isced-f/0713,
KnowledgeSkillCompetence,http://data.europa.eu/esco/skill/c71e5209-dfb8-456d-a1ad-5ac657a92812,استخدام نماذج الزراعة,released,skill/competence,sector-specific,,"بناء وتطبيق معادلة فيزيائية وحسابية بهدف دراسة تسميد المزارعين، إدارة أوقات الري، تحديد أهداف التناسل، دعم اختيارات الزراعة في بيئة معينة وتقدير الأداء البيئي لإنتاج المحصول.
	",http://data.europa.eu/esco/skill/47b0d855-ea3c-45e9-8dcf-0e12e62261c4 | http://data.europa.eu/esco/skill/38d49d88-9069-467b-b29e-3cae739bdd4d,إجراء الحسابات والتقديرات | وضع أنظمة التنبؤ
KnowledgeSkillCompetence,http://data.europa.eu/esco/skill/c76ea1b8-25a3-4084-a684-dcf10b7c880c,علم أصول التدريس البيئي,released,knowledge,sector-specific,,"نهج تعليمي يعزز الوعي البيئي من خلال دمج مبادئ البيئة والاستدامة في التدريس. ويهدف إلى زيادة المسؤولية الاجتماعية وإنهاء الظلم الاجتماعي البيئي.
	",http://data.europa.eu/esco/isced-f/0111,
KnowledgeSkillCompetence,http://data.europa.eu/esco/skill/c8195036-dab3-4d87-b83b-395a59b18a42,اتخاذ القرارات المتعلقة بإدارة الغابات,released,skill/competence,sector-specific,,اتخاذ القرارات بشأن القضايا المُتعلقة بالجوانب المُختلفة ذات الصلة بإدارة الموارد الطبيعية مثل الغابات ومناطق الأراضي المشجرة.,http://data.europa.eu/esco/skill/d62d2b4c-a6f8-439e-8a1b-4f29ab5f2c47 | http://data.europa.eu/esco/skill/c7f96545-46c4-451a-b284-014f4baed5ed,صناعة القرارات | اتّخاذ القرارات
KnowledgeSkillCompetence,http://data.europa.eu/esco/skill/c8b34758-5954-4388-b475-a4e57b3906ac,تكنولوجيا حضانة المياه الخضراء,released,knowledge,occupation-specific,,استخدام تكنولوجيا حضانة المياة الخضراء أثناء تفريخ الأحياء المائية.,http://data.europa.eu/esco/isced-f/0831,
KnowledgeSkillCompetence,http://data.europa.eu/esco/skill/c8b4b02c-d9ce-4e24-ab43-5dd52c6dff48,تقديم المشورة بشأن خفض انبعاثات الكربون,released,skill/competence,cross-sector,,"تقديم المشورة للشركات بشأن خفض انبعاثات الكربون في قطاع الصناعة، وتحديد الحوافز، وإبقاء الشركات على اطلاع دائم باللوائح والسياسات الخاصة بانبعاثات الكربون، وكذلك بأساليب الخفض المبتكرة.
	",http://data.europa.eu/esco/skill/062a9fde-cd91-44f9-9a2f-9e2bc3b281fd,تقديم المشورة بشأن القضايا البيئية
KnowledgeSkillCompetence,http://data.europa.eu/esco/skill/c9b97523-d520-4494-aa60-e3bc9ef0d8a4,طحن النفايات البلاستيكية,released,skill/competence,sector-specific,,طحن النفايات البلاستيكية لتحويلها إلى مسحوق لإعادة استخدامها مرةً أخرى.,http://data.europa.eu/esco/skill/a7956044-f468-4bc1-a83c-a8821b903a09,تشغيل ماكينات القطع والطحن والتنعيم
KnowledgeSkillCompetence,http://data.europa.eu/esco/skill/c9bb544b-99a1-4335-bcea-23f84b01095a,وضع استراتيجيات لإدارة النفايات غير الخطرة,released,skill/competence,cross-sector,,وضع إستراتيجيات تهدف إلى زيادة الكفاءة في معاملات المنشأة، ووسائل النقل، والتخلص من نفايات المواد غير الخطرة مثل التعبئة، والمنسوجات، وبقايا الطعام، والحطام، والأوراق.,http://data.europa.eu/esco/skill/6ee936b0-4e0c-4e04-97c7-1f4ee9230d67 | http://data.europa.eu/esco/skill/7a8fb784-67fa-41e9-a75c-6b491d91f800,وضع الأهداف والاستراتيجيات | وضع استراتيجية لحل المشاكل
KnowledgeSkillCompetence,http://data.europa.eu/esco/skill/c9eea75d-918e-4733-bf1d-86ecd7a04946,إجراء الدراسات والتحقيق الميداني,released,skill/competence,occupation-specific,,تصميم الدراسات وتحقيق الميداني وإجراؤها على النحو المطلوب. فحص المناظر الطبيعية باستخدام التقنيات والإجراءات المقررة.,http://data.europa.eu/esco/skill/7eafec38-621a-4b6e-9298-bfe70ec0b253,تنفيذ البحوث الأكاديمية أو أبحاث السوق
