conceptType,conceptUri,preferredLabel,status,skillType,reuseLevel,altLabels,description,broaderConceptUri,broaderConceptPT
KnowledgeSkillCompetence,http://data.europa.eu/esco/skill/3a519990-ae6c-4c8b-a827-2bf96d949940,إدارة المحافظة على التراث الطبيعي والثقافي,released,skill/competence,sector-specific,,"توظيف الإيرادات من الأنشطة السياحية والتبرعات في تمويل والمحافظة على المناطق الطبيعية المحمية والتراث الثقافي غير المادي مثل المصنوعات اليدوية والأغاني وقصص المجتمعات.
   ",http://data.europa.eu/esco/skill/193af349-b20e-4277-94bf-b184e92b8d6a,إدارة الميزانيات أو الموارد المالية
KnowledgeSkillCompetence,http://data.europa.eu/esco/skill/3a560dc4-ee2e-4437-b94f-c076a2b5f25e,فحص آبار المياه,released,skill/competence,cross-sector,,فحص آبار المياه للتحقق من عدم وجود تلوث والامتثال لمعايير الإنشاء. طلب غلق البئر إن لزم الأمر.,http://data.europa.eu/esco/skill/0e0a44a8-654c-4e85-986a-fb4386114838,مراقبة السلامة أو الأمن
KnowledgeSkillCompetence,http://data.europa.eu/esco/skill/3b4f2a64-9884-4f3d-8020-44dc95919a7c,تصميم مفهوم العزل,released,skill/competence,sector-specific,,"تصميم تفاصيل العزل والحلول للجسور الحرارية. انتقاء أفضل مواد العزل ملائمة، باعتبار احتياجات المبنى.
	",http://data.europa.eu/esco/skill/39fa260c-4f85-48e3-83ce-e292e696c233,تصميم الأنظمة أو المعدات الكهربائية أو الإلكترونية
KnowledgeSkillCompetence,http://data.europa.eu/esco/skill/3bf93cf6-2b6f-46ad-b0ba-3b161379bac1,إجراء عمليات التدمير الانتقائي,released,skill/competence,sector-specific,,"هدم بناءً أو جزءًا منه باستخدام الهدم الانتقائي. تحديد المواد المختلفة في البناء وتقييم إمكانية إعادة استعمالها وقيمتها. إزالة أي مواد قابلة للاستعمال دون تدميرها.
	",http://data.europa.eu/esco/skill/59c46f34-bffd-4859-adf4-3839c2a73821,التشييد
KnowledgeSkillCompetence,http://data.europa.eu/esco/skill/3c1622fc-6c95-4b51-98da-1814ebe6e889,أنظمة الطاقة الجيوحرارية,released,knowledge,sector-specific,,"تدفئة الحرارة المنخفضة وتبريد الحرارة المرتفعة، المتولدة عن استعمال الطاقة الحرارية الأرضية والمساهمات الأخرى في أداء الطاقة.
	",http://data.europa.eu/esco/isced-f/0713,
KnowledgeSkillCompetence,http://data.europa.eu/esco/skill/3d69b305-4051-4c1d-ba1e-d8c5b35e22db,رصد تأثير عملية التصنيع,released,skill/competence,cross-sector,,التحقق من تأثير آلات التصنيع في البيئة، وتحليل مستويات درجات الحرارة، وجودة الماء، وتلوث الهواء.,http://data.europa.eu/esco/skill/4c3ab565-747c-4db3-8c47-79e8d6f98cf4 | http://data.europa.eu/esco/skill/7dd94ad3-13d6-43fe-8b94-51fcbf67ced9 | http://data.europa.eu/esco/skill/d519fadd-85bf-475f-bf14-c53a0290687d,تبني سبل تخفيف وطأة الاستهلاك السلبية | التفكير الناقد | مراقبة الظروف البيئية
KnowledgeSkillCompetence,http://data.europa.eu/esco/skill/3d9873e5-7128-49d9-9048-f72b8ea4b29e,ادارة  الغابات,released,skill/competence,sector-specific,,وضع خطط إدارة الغابات من خلال تطبيق طرق الأعمال ومبادئ الغابات من أجل إدارة موارد الغابة بكفاءة.,http://data.europa.eu/esco/skill/87dff904-fb74-4d59-972e-1c2387579d94,توجيه الأنشطة التنفيذية
KnowledgeSkillCompetence,http://data.europa.eu/esco/skill/3de6d427-546b-450b-97ba-d3d50eb274da,تشغيل معدات تنقية المياه,released,skill/competence,cross-sector,,تشغيل وضبط عناصر التحكم بالمعدات لتنقية المياه وتصفيتها، وتجهيز ومعالجة مياه الصرف الصحي، والهواء والمواد الصلبة، وإعادة تدوير المياه المعالجة أو صرفها، وتوليد الطاقة.,http://data.europa.eu/esco/skill/d3b2c894-33fb-47c4-aff0-27935a082bf6,تشغيل أنظمة أو معدات معالجة البترول أو الكيماويات أو المياه
KnowledgeSkillCompetence,http://data.europa.eu/esco/skill/3dffcb35-26d4-4fee-8517-002f9e40508a,إدخال طاقة الغاز الحيوي في المباني,released,skill/competence,sector-specific,,"تصميم وحساب تكلفة التركيبات للتدفئة والماء الساخن الصالح للشرب باستعمال الغاز الحيوي.
	",http://data.europa.eu/esco/skill/b85caa4a-f04b-4331-80df-11404fd71225,تركيب معدات التدفئة والتهوية وتكييف الهواء
KnowledgeSkillCompetence,http://data.europa.eu/esco/skill/3e25fd3e-2bcd-4320-9587-0aadf7fb93b1,تقديم المشورة بخصوص حماية التربة والمياه,released,skill/competence,sector-specific,,"تقديم النصح حول طرق حماية التربة والمصادر المائية من التلوث مثل ارتشاح النترات الذي يسبب تعرية التربة.
    ",http://data.europa.eu/esco/skill/062a9fde-cd91-44f9-9a2f-9e2bc3b281fd,تقديم المشورة بشأن القضايا البيئية
KnowledgeSkillCompetence,http://data.europa.eu/esco/skill/3e37d714-4d65-416d-a138-46f7e2a98073,تصميم تركيبات المضخات الحرارية,released,skill/competence,sector-specific,,"تصميم نظام المضخة الحرارية، بما فيه حسابات فقد الحرارة أو نقلها، والقدرة اللازمة، الأحادية أو المزدوجة، وموازنة الطاقة وخفض الضوضاء.
	",http://data.europa.eu/esco/skill/39fa260c-4f85-48e3-83ce-e292e696c233,تصميم الأنظمة أو المعدات الكهربائية أو الإلكترونية
KnowledgeSkillCompetence,http://data.europa.eu/esco/skill/3ecde258-d1c6-4d6a-bfa7-ec4c5e4fc700,تطوير حلول المركبات الخضراء,released,skill/competence,occupation-specific,,"تطوير حلول المركبات التي تستعمل العناصر البيولوجية بدلا من الصناعية. تقدير إمكانيات الزيوت النباتية، ومواد الحشو والبوليمرات وما حققته من تقدم في الآونة الأخيرة.
	",http://data.europa.eu/esco/skill/c23e0a2f-f04b-45bc-b0dd-20571f6b502c,تطوير السياسات والإجراءات التشغيلية
KnowledgeSkillCompetence,http://data.europa.eu/esco/skill/3edfa33c-c644-4a9a-acd1-e82039daa663,تشجيع استعمال وسائل المواصلات المستديمة,released,skill/competence,sector-specific,,"تشجيع استعمال وسائل المواصلات المستديمة من أجل خفض بصمة الكربون والضوضاء وزيادة الأمن وفعالية أنظمة المواصلات. تحديد الأداء فيما يتعلق باستعمال وسائل المواصلات المستديمة، تحديد أهداف تشجع على استعمال وسائل المواصلات المستديمة واقتراح بدائل للمواصلات رفيقة بالبيئة.
   ",http://data.europa.eu/esco/skill/469e19ed-a0bd-445a-ae2d-4ba9430e296b | http://data.europa.eu/esco/skill/efb60300-0d55-4b2c-8038-8409587a4727,تعزيز الاستدامة | ترويج المنتجات أو الخدمات أو البرامج
KnowledgeSkillCompetence,http://data.europa.eu/esco/skill/3efd2b02-f6f8-4911-a154-8bfcaeadeb5d,منشأ الدهون والزيوت في الأنظمة الغذائية,released,knowledge,sector-specific,,التمييز بين الدهون الغذائية التي تأتي من الحيوانات والزيوت المشتقة من الخضروات.,http://data.europa.eu/esco/isced-f/0721,
KnowledgeSkillCompetence,http://data.europa.eu/esco/skill/3f82a026-8a37-4b54-9ebb-7702b66eeb24,اجراء الأبحاث البيئية,released,skill/competence,sector-specific,,إجراء الأبحاث البيئية على النحو المطلوب، مع التحقق من الإجراءات التنظيمية، والإجراءات القانونية الممكنة أو أنواع أخرى من الشكوى.,http://data.europa.eu/esco/skill/c4376e35-add7-43a0-8b2e-f5741f0df8fe,تنفيذ تحريات الشرطة والجنائية
KnowledgeSkillCompetence,http://data.europa.eu/esco/skill/407b1474-7cfb-4538-823b-7667604f0267,استعادة البيئة الطبيعية بعد تجارب الحفر,released,skill/competence,occupation-specific,,إعادة موقع الحفر إلى حالته البيئية الطبيعية في حالة عدم القيام بالحفر.,http://data.europa.eu/esco/skill/aca5081a-ceb0-4028-9cc5-1daafd4f86f9,تطوير الحلول
KnowledgeSkillCompetence,http://data.europa.eu/esco/skill/40f65a56-ccbe-4601-9f32-1cc6cdd24f28,إدارة النفايات,released,knowledge,cross-sector,,الطرق والمواد واللوائح المستخدمة لجمع ونقل ومعالجة النفايات والتخلص منها. ويشمل ذلك إعادة التدوير ومراقبة التخلص من النفايات.,http://data.europa.eu/esco/isced-f/1021,
KnowledgeSkillCompetence,http://data.europa.eu/esco/skill/40fa39b5-0f69-432a-b5ea-b01b5d98649a,التخلص من النفايات الخطرة,released,skill/competence,cross-sector,,التخلص من المواد الخطرة مثل المواد الكيميائية أو المشعة وفقًا للوائح البيئة، والصحة، والسلامة.,http://data.europa.eu/esco/skill/d2d9051a-10e1-41c5-9cfb-bbdc58016176 | http://data.europa.eu/esco/skill/8bde58aa-9d5b-422b-801c-ff9186dd648e,إتباع احتياطات السلامة في ممارسات العمل | مناولة المواد الخطرة والتخلص منها
KnowledgeSkillCompetence,http://data.europa.eu/esco/skill/41168850-6e3f-4fc8-afd5-9337f0c66190,اجراء تقييم الأثر البيئي في عمليات تربية الأحياء المائية,released,skill/competence,sector-specific,,قياس الأثر البيئي لعمليات تربية الأحياء المائية الخاصة بالشركة. الوضع في الاعتبار جودة البحر، وسطح الماء، وبيئات الأسماك والنباتات البحرية، والمخاطر فيما يتعلق بجودة الهواء، والرائحة، والضوضاء.,http://data.europa.eu/esco/skill/444d3725-902f-49aa-9363-7de405bb991d | http://data.europa.eu/esco/skill/e541c69c-ea80-4b17-87cb-4001d0b9d303 | http://data.europa.eu/esco/skill/d519fadd-85bf-475f-bf14-c53a0290687d | http://data.europa.eu/esco/skill/d86babea-bf8b-4552-81a8-daf706066ad6,قياس تأثير أنشطة تربية المائيات المحددة | تقييم الأثر البيئي | مراقبة الظروف البيئية | إدارة الأثر البيئي للعمليات
KnowledgeSkillCompetence,http://data.europa.eu/esco/skill/41bbfa08-ce0b-478f-beaa-f51c62e61796,تركيب نوافذ السقف,released,skill/competence,sector-specific,,تركيب أنواع النوافذ المختلفة على السقف مثل نوافذ المنور، والكوات، ونوافذ السقف المسطحة.,http://data.europa.eu/esco/skill/58edb789-d085-4e7d-8b6e-b70913bebfca,تركيب وتجميع تجهيزات البناء
KnowledgeSkillCompetence,http://data.europa.eu/esco/skill/41de7eb8-be07-4822-ba85-b76e9b8d6e4e,إدارة استدامة الغابات,released,knowledge,sector-specific,,"إدارة واستخدام أراضي الغابات بطريقة وبمعدل يحافظان على إنتاجيتها، وتنوعها الإحيائي وقدرتها على التجدد، والحيوية وقدرتها على أداء وظائفها الإيكولوجية والاقتصادية والاجتماعية، اليوم وفي المستقبل، على المستويات المحلية والقومية والعالمية وعدم إلحاقها ضرراً بالأنظمة الإيكولوجية الأخرى.
	",http://data.europa.eu/esco/isced-f/0821,
KnowledgeSkillCompetence,http://data.europa.eu/esco/skill/4300b453-9bcf-474c-9ee3-92ec2229720c,المعايير العالمية لتقارير الاستدامة,released,knowledge,sector-specific,,"إطار عمل إعداد التقارير المُقيسة على المستوى العالمي والتي تسمح للمنظمات بتقدير وتبليغ الآثار البيئية والاجتماعية والإدارية.
	",http://data.europa.eu/esco/isced-f/0412,
KnowledgeSkillCompetence,http://data.europa.eu/esco/skill/442328a8-8a11-4e15-b80c-402a9bd5844d,إجراء الأبحاث على العمليات المناخية,released,skill/competence,cross-sector,,إجراء الأبحاث على الأحداث المميَّزة التي تقع في الغلاف الجوي أثناء تفاعلات مختلف المكونات والظروف الجوية وتحولاتها.,http://data.europa.eu/esco/skill/7eafec38-621a-4b6e-9298-bfe70ec0b253,تنفيذ البحوث الأكاديمية أو أبحاث السوق
KnowledgeSkillCompetence,http://data.europa.eu/esco/skill/44493977-83c4-49e0-88b2-28435da57cd0,التقليل من التأثير البيئي على المنطقة المحيطة,released,skill/competence,occupation-specific,,تقليل هدر المواد والتخلص من الحطام بصورة صحيحة. التقليل من الضرر للنباتات، والمعالم، والمناطق المحيطة.,http://data.europa.eu/esco/skill/64acded2-d944-4f85-a703-cfe9375f706a,تشغيل المعدات الزراعية أو معدات الغابات
KnowledgeSkillCompetence,http://data.europa.eu/esco/skill/444d3725-902f-49aa-9363-7de405bb991d,قياس تأثير أنشطة تربية المائيات المحددة,released,skill/competence,sector-specific,,تحديد وقياس الآثار البيولوجية، والفيزيائية، والكيميائية على البيئة لأنشطة محددة بمزارع المائيات. تنفيذ كافة الاختبارات اللازمة؛ بما فيها جمع العينات لتحليلها.,http://data.europa.eu/esco/skill/23d7bd85-d8d5-4455-b64d-3b0998f2425d,قياس الأبعاد والخصائص ذات الصلة
KnowledgeSkillCompetence,http://data.europa.eu/esco/skill/44d5340c-45df-4478-9e55-2363342a7324,تصميم الحلول لإعادة تجهيز المباني,released,skill/competence,sector-specific,,"تزويد شيء ما بمكون أو ميزة لم يتم تركيبها أثناء التصنيع أو إضافة شيء ما لم يكن موجوداً عند الإنشاء لأول مرة.  ويُستخدم فيما يتعلق بتركيب أنظمة البناء الجديدة، مثل أنظمة التدفئة، ولكنه قد يشير أيضاً إلى نسيج المباني، وعلى سبيل المثال، تعديل العزل أو الزجاج المزدوج.  وتصميم الحلول اللازمة لتحديث مساحة المباني السكنية والتجارية القائمة من أجل تحسين أدائها، على سبيل المثال عن طريق خفض استخدام الطاقة والمياه.  وتقييم مجموعة من التقنيات التحديثية المتاحة واختيار الأنسب منها بناءً على خصائص المباني.
	",http://data.europa.eu/esco/skill/2eea3fd6-82ee-4334-8e36-62a0707cade1 | http://data.europa.eu/esco/skill/cc0a45a7-4883-4122-af11-7ca6c45a37c2 | http://data.europa.eu/esco/skill/b2c688b0-9106-466d-8b88-eafdfe608e7d,تصميم المباني كتيمة الهواء | تصميم أنظمة غلاف المبنى | تصميم الهياكل أو المرافق
KnowledgeSkillCompetence,http://data.europa.eu/esco/skill/450aeb6d-5f23-4e08-b088-3bbefbfb9f2d,علم البيئة المائي,released,knowledge,cross-sector,,علم البيئة المائي هي دراسة الكائنات المائية، وكيفية تفاعلها، وأين تعيش، وماذا تفعل.,http://data.europa.eu/esco/isced-f/0521,
KnowledgeSkillCompetence,http://data.europa.eu/esco/skill/4548416b-2310-4afc-bd6a-c022d3e41014,التأكد من فاعلية التكاليف في تصنيع الأغذية,released,skill/competence,sector-specific,,التأكد من أن عملية تصنيع الأغذية بأكملها بدءًا من استلام المواد الخام، والإنتاج، إلى تصنيع الأغذية وعمليات التعبئة والتغليف فعالة وكفء من حيث التكلفة.,http://data.europa.eu/esco/skill/ce541a71-0eaa-40e7-999d-793d1f16fa4c | http://data.europa.eu/esco/skill/7a93e22f-54d8-4bf0-9213-d711f6601b49 | http://data.europa.eu/esco/skill/0779d482-4154-4fbb-9a22-d9fd89c39d67,ملائمة الممارسات الفعالة لتجهيز الأغذية | العمل بكفاءة | تنظيم الأعمال والأنشطة وتخطيطها وجدولتها
KnowledgeSkillCompetence,http://data.europa.eu/esco/skill/4562497f-836c-415a-b5ce-4ec3b5766d09,اقتراح مكونات عناصر بديلة للمطاط,released,skill/competence,occupation-specific,,"التعرف على المكونات السامة المحتملة ضمن مركبات المطاط واقتراح بدائل للمكونات أو المركبات بنفس الوظائف.
	",http://data.europa.eu/esco/skill/aca5081a-ceb0-4028-9cc5-1daafd4f86f9,تطوير الحلول
KnowledgeSkillCompetence,http://data.europa.eu/esco/skill/456f68b4-ca28-4029-a67f-7813b2c6cb4d,الأخلاقيات الخاصة بالغذاء,released,knowledge,sector-specific,,"مجموعة القيم والمبادئ الأخلاقية التي توجه إنتاج وتوزيع واستهلاك الغذاء. وهي يشمل مجموعة واسعة من المسائل، بما في ذلك سلامة الأغذية، والاستدامة البيئية، والحساسية الثقافية، وممارسات العمل العادلة، ورعاية الحيوان، والمسؤولية الاجتماعية. ويمكن أن تشمل الأخلاقيات الخاصة بالغذاء الاضطلاع بالمسؤولية على الصعيدين الجماعي والفردي.
	",http://data.europa.eu/esco/isced-f/0223,
KnowledgeSkillCompetence,http://data.europa.eu/esco/skill/45b2a257-1c28-4c84-bc71-a4871e398c54,البحث عن مواقع مزارع طاقة الرياح,released,skill/competence,sector-specific,,إجراء أبحاث بالموقع واستخدام أطلس رياح من أجل تقييم المواقع المختلفة التي يمكن أن تكون مناسبة لإنشاء مجموعة من توربينات الرياح فضلًا عن أداء أبحاث متابعة للموقع من أجل المساعدة في وضع خطط الإنشاء.,http://data.europa.eu/esco/skill/3eef7ff2-3ade-41d4-b084-2bd2a3949e1c,تقييم الأراضي أو العقارات
KnowledgeSkillCompetence,http://data.europa.eu/esco/skill/45b79278-465a-4eed-8809-369318bab119,وضع استراتيجيات معالجة المواقع,released,skill/competence,sector-specific,,إجراء دراسات ميدانية وتقديم المشورة حول المناطق ذات التربة أو المياه الجوفية الملوَّثة بالمواقع الصناعية ومواقع التعدين. ابتكار طرق لتخزين التربة المحفورة. وضع إستراتيجيات لاستعادة مواقع التعدين المستنزفة إلى حالتها الطبيعية.,http://data.europa.eu/esco/skill/c23e0a2f-f04b-45bc-b0dd-20571f6b502c | http://data.europa.eu/esco/skill/e4ff825c-7376-4135-93cd-3892fd67b7c1,تطوير السياسات والإجراءات التشغيلية | وضع استراتيجيات علاجية بيئية
KnowledgeSkillCompetence,http://data.europa.eu/esco/skill/46454506-fb7c-4ad7-84e0-d4a6a5589ea1,تصميم مبانٍ مستدامة ذاتيًا,released,knowledge,sector-specific,,مبدأ التصميم والبناء الذي تساوي به كمية الطاقة الصافية التي يستخدمها المبنى مقدار الطاقة المتجددة التي أنشأها المبنى نفسه. يشير المفهوم إلى إنشاءات مكتفية ذاتيا.,http://data.europa.eu/esco/isced-f/0731,
KnowledgeSkillCompetence,http://data.europa.eu/esco/skill/465af498-53b1-4e04-9f49-7458afb59274,تصميم معدات المنشأة,released,skill/competence,sector-specific,,تصميم المعدات المستخدمة في توفير خدمات المرافق، مثل التدفئة، والبخار، والكهرباء، والتبريد من أجل تحسين كفاءة واستدامة توفير المرافق للمنشآت والعقارات السكنية.,http://data.europa.eu/esco/skill/b2c688b0-9106-466d-8b88-eafdfe608e7d,تصميم الهياكل أو المرافق
KnowledgeSkillCompetence,http://data.europa.eu/esco/skill/467cfa0a-f6d8-4f07-a770-11d2ea3546cd,خفض انبعاثات الدباغة,released,skill/competence,sector-specific,,"ضبط تركيبة عملية التشطيب حسب كل نوع سوق الجلود المقصود وتفادي انبعاثات المركبات العضوية المتطايرة (VOC).
	",http://data.europa.eu/esco/skill/8064ae65-5d1b-44e1-9aaf-246a4285a9a6,الالتزام بقوانين ومعايير حماية البيئة
KnowledgeSkillCompetence,http://data.europa.eu/esco/skill/469e19ed-a0bd-445a-ae2d-4ba9430e296b,تعزيز الاستدامة,released,skill/competence,cross-sector,,تعزيز مفهوم الاستدامة لدى الجمهور، والزملاء، والزملاء من المتخصصين من خلال الخطب، والجولات السياحية، والعروض، وورش العمل.,http://data.europa.eu/esco/skill/efb60300-0d55-4b2c-8038-8409587a4727,ترويج المنتجات أو الخدمات أو البرامج
KnowledgeSkillCompetence,http://data.europa.eu/esco/skill/47d491a9-f7c0-4b13-a10f-983d3aa0113e,هندسة السلامة,released,knowledge,cross-sector,,"دراسة المخاطر المرتبطة بالتصاميم والأنظمة الهندسية، والوقاية من الحوادث، وكذلك فوائد السلامة للحد من الوفيات والإصابات. ويركز الانضباط على تحليل وخفض المخاطر المحتملة في العمليات الهندسية.
	",http://data.europa.eu/esco/skill/6f1edc19-191f-4ba5-a048-ee69aff05bab | http://data.europa.eu/esco/isced-f/0710,
KnowledgeSkillCompetence,http://data.europa.eu/esco/skill/47f14289-3bcd-4575-9cc1-15c582d1da29,ادارة مرفق معالجة النفايات,released,skill/competence,occupation-specific,,إدارة عمليات المرفق التي تتعامل مع معالجة المخلفات والتخلص منها؛ مثل إجراءات الفرز، وإعادة التدوير، والتخزين، وضمان صيانة المرفق ومعداته، والإجراءات المتماثلة مع التشريعات.,http://data.europa.eu/esco/skill/746d4d58-7e6b-417c-a0b3-3f0c44564a2e | http://data.europa.eu/esco/skill/87dff904-fb74-4d59-972e-1c2387579d94 | http://data.europa.eu/esco/skill/73a9561d-112c-4d8a-9d5f-b2c11c5bbd5f,تخطيط سياسات إدارة المرافق | توجيه الأنشطة التنفيذية | إدارة النفايات
KnowledgeSkillCompetence,http://data.europa.eu/esco/skill/4817fa29-7e52-41ee-a112-c1454012ca95,استعراض خطط بناء مرافق معالجة النفايات,released,skill/competence,occupation-specific,,تحديد ما إن كانت خطط مرافق معالجة النفايات الجديدة تتوافق مع المراسيم.,http://data.europa.eu/esco/skill/ebbf3488-7d1e-4603-b7d4-938d23bc1af1 | http://data.europa.eu/esco/skill/54f7432d-a8b6-4ed4-a50e-9ec882320595,مراجعة أذونات خطط البناء | الرصد والمعاينة والاختبار
KnowledgeSkillCompetence,http://data.europa.eu/esco/skill/492214f5-5bfd-4f2a-9a48-c36240ce100d,اتباع السياسات المراعية للبيئة أثناء تصنيع الأغذية,released,skill/competence,sector-specific,,الحرص على السياسة المراعية للبيئة عند العمل بالموارد الطبيعية؛ مثل اللحوم، والفواكه، والخضراوات. يعني ذلك معالجة الموارد بأكثر الطرق كفاءة ومراعاة للطبيعة أثناء محاولة تقليل الضغط على النظام البيئي.,http://data.europa.eu/esco/skill/4c3ab565-747c-4db3-8c47-79e8d6f98cf4 | http://data.europa.eu/esco/skill/2aaad52d-599e-4e77-a681-bbc236825821 | http://data.europa.eu/esco/skill/8064ae65-5d1b-44e1-9aaf-246a4285a9a6,تبني سبل تخفيف وطأة الاستهلاك السلبية | تقييم آثار التصرفات الشخصية على البيئة | الالتزام بقوانين ومعايير حماية البيئة
